*Algorithm,Overall Accuracy,Raw Pitch Accuracy,Raw Chroma Accuracy,Voicing Recall Rate,Voicing False-Alarm Rate,Author
HJ1,0.7617,0.8315,0.8423,0.8206,0.1427,"Chao-Ling Hsu, Jyh-Shing Roger Jang"
JJY1,0.629,0.822,0.8457,0.9834,0.7065,"Sihyun Joo, Seokhwan Jo, Chang D. Yoo"
JJY2,0.6255,0.8129,0.8383,0.9833,0.7062,"Sihyun Joo, Seokhwan Jo, Chang D. Yoo"
SG1,0.7359,0.8005,0.855,0.8965,0.3022,"Justin Salamon, Emilia Gomez"
TOOS1,0.7223,0.8259,0.8618,0.9417,0.3858,"Hideyuki Tachibana, Takuma Ono, Nobutaka Ono, Shigeki Sagayama"
